{
  "$schema": "https://json-schema.org/draft-07/schema",
  "type": "object",
  "properties": {
    "id": {
      "type": "string"
    },
    "page_id": {
      "type": "string"
    },
    "group_id": {
      "type": [
        "string",
        "null"
      ]
    },
    "created_at": {
      "type": "string"
    },
    "updated_at": {
      "type": "string"
    },
    "group": {
      "type": "boolean"
    },
    "name": {
      "type": "string"
    },
    "description": {
      "type": [
        "string",
        "null"
      ]
    },
    "position": {
      "type": "integer"
    },
    "status": {
      "type": "string"
    },
    "showcase": {
      "type": "boolean"
    },
    "only_show_if_degraded": {
      "type": "boolean"
    },
    "automation_email": {
      "type": "string"
    },
    "start_date": {
      "type": [
        "string",
        "null"
      ]
    }
  }
}
